ID,Healthcare_Name,Street_Address,City,Zipcode,State,Associated_Health_System,Funding_Type,CHNA_Year,Service_Area_Type,Service_Area_Counties,Service_Area_Zip,Service_Area_Places,Health_Needs,Health_Priorities,CHNA_URL,Implementation_URL,Contact
,,,,,,,Non-Profit,2022,List of Places,N/A,N/A,"Virginia Beach, Norfolk, Chesapeake","Asthma, Cancer; Cardiovascular health; heart disease/ Hypertension; Chronic pain management (sciatic pain, sickle cell, joint pain etc.); COVID-19; Dental health; Diabetes; Health care expenses; Mental Health (anxiety and depression); Mold (environmental factors); Obesity; Sexual Health; Sickle Cell; Smoking and vaping; Substance Use","Chronic Disease, Behavioral Health/Substance Abuse (including Opioid Addiction), Social Determinants of Health & Community Partnerships to Improve Health",https://www.sentara.com/Documents/s/slhloscchna2022pdf-275452,N/A,N/A
6340120,Sentara Martha Jefferson Hospital,500 Martha Jefferson Drive,Charlottesville,22911-4668,VA,Sentara Healthcare,Non-Profit,2022,Combination of counties and places,"Fluvana, Greene, Louisa, Nelson",N/A,"Charlottesville, Albmarle",N/A,"Promote healthy Eating & active living, Address mental health & substance use, Reduce health disparities & improve access to care, Foster a healthy and connected community for all ages",https://www.sentara.com/Documents/2/2022mapp2healthreportpdf-275214,https://www.sentara.com/Assets/Pdf/About-Us/Community-Health-Needs-Assessments/2019-SMJH-CHNA-Supplemental-Report.pdf,N/A
6340620,Sentara Norfolk General Hospital,600 Gresham Drive,Norfolk,23507-1904,VA,Sentara Healthcare,Non-Profit,2022,Combination of counties and places,"The Isle of Wight, Southampton",N/A,"Norfolk, Chesapeake, Virginia Beach, Portsmouth, Suffolk, Franklin","SDOH, education, poverty, employment, help applying for state programs like medicaid and medicare","Healthy & Connected Communities; Heart Health; Women's Health; Gun Violence, Accidents, and Other Trauma; Mental Health and Substance Abuse",https://www.sentara.com/Documents/2/2022snghchnapdf-275207,N/A,N/A
6341210,Sentara Northern Virginia Medical Center,2300 Opitz Boulevard,Woodbridge,22191-3399,VA,Sentara Healthcare,Non-Profit,2022,Combination of counties and zip codes,"Prince William, Stafford, Lorton section of Fairfax",22079,N/A,"Chronic Disease and Conditions, Access to Healthcare, Behavioral Health / Substance Use (including Opioid Addiction), Social Determinants of Health: Nutrition/Physical Activity (including Obesity)","Behavioral Health, Chronic Disease, Social Determinants of Health",https://shc-p-001.sitecorecontenthub.cloud/api/public/content/71d3c82b5a13449280bc606aa127f724?v=369e5c5d,https://shc-p-001.sitecorecontenthub.cloud/api/public/content/71d3c82b5a13449280bc606aa127f724?v=369e5c5d,N/A
6341153,Sentara Obici Hospital,2800 Godwin Boulevard,Suffolk,23434-8038,VA,Sentara Healthcare,Non-Profit,2022,Combination of counties and places,"The Isle of Wight, Southampton, Gates, Sussex, Surry",N/A,"Suffolk, Franklin","Chronic Disease (including Diabetes, Heart Disease, Cancer); Mental health & Substance Abuse; Nutrition (to include Obesity and Hunger)","Chronic Disease (including Diabetes, Heart Disease, Cancer); Mental health & Substance Abuse; Nutrition (to include Obesity and Hunger)",https://shc-p-001.sitecorecontenthub.cloud/api/public/content/17cfb5929bfe4bd1b97e4117b7fb70b4?v=ecb04481,N/A,N/A
6341145,Sentara Princess Anne Hospital,2025 Glenn Mitchell Drive,Virginia Beach,23456-0178,VA,Sentara Healthcare,Non-Profit,2022,List of Places,N/A,N/A,"Virginia Beach, Chesapeake",Behavioral Health/Substance Use (including Opioid Addiction),"Diabetes, Obesity, Heart Disease/High Blood Pressure, Cancer, Senior Health",https://www.sentara.com/aboutus/community-outreach/community-health-needs-assessments.aspx,N/A,N/A
6340340,Sentara RMH Medical Center,2010 Health Campus Drive,Harrisonburg,22801-3293,VA,Sentara Healthcare,Non-Profit,2022,Combination of zip codes and places,N/A,"22801, 22802, 22807, 22811, 22812, 22815, 22820, 22821, 22827, 22830, 22831, 22832, 22834, 22835, 22840, 22841, 22842, 22843, 22844, 22846, 22847, 22849, 22850, 22851, 22853, 24401, 24437, 24441, 24463, 24467, 24471, 24482, 24486, 26802, 26807, 26815, 26838","Harrisonburg City, Staunton City, Pendleton, Rockingham, Shenandoah, Page, Hardy",Social Determinants of Health: Nutrition/Physical Activity (including Obesity),"Behavioral Health, Chronic Disease, Social Determinants of Health",https://www.sentara.com/aboutus/community-outreach/community-health-needs-assessments.aspx,N/A,N/A
6341162,Sentara Virginia Beach General Hospital,1060 First Colonial Road,Virginia Beach,23454-3002,VA,Sentara Healthcare,Non-Profit,2019,List of Places,N/A,N/A,Virginia Beach City,"Mortality Profile, Hospitalization for Chronic and other Conditions, Cancer, Behavioral Health, Opioid Epidemic, Alzheiemer's Disease","Chronic Disease (Cancer, Heart Disease, Stroke, Diabetes); Behavioral Health (Mental Health, Substance Abuse, Opioid Addiction); Social Determinants fo Health and community Partnerships",https://www.sentara.com/aboutus/community-outreach/community-health-needs-assessments.aspx,N/A,N/A
,,,,,,,Non-Profit,2022,List of Places,N/A,N/A,Virginia Beach,"Anxiety and depression, Asthma, Cancer, Cardiovascular health, Chronic pain management, COPD, Dental health, Diabetes, Health care expenses, Heart Disease, High Blood Pressure, Hypertension, Mental Health, Mold, environmental factors. Obesity, Sciatic nerve, Sexual Health, Sickle Cell, Smoking and vaping, Substance Use","Behavioral Health, Chronic Disease, Social Determinants of Health",https://www.sentara.com/aboutus/community-outreach/community-health-needs-assessments.aspx,N/A,N/A
6341195,Sentara Williamsburg Regional Medical Center,100 Sentara Circle,Williamsburg,23188-5713,VA,Sentara Healthcare,Non-Profit,2019,Combination of counties and places,"James City, Gloucestor, York, Charles City, New Kent, King Willliam, King and Queen, Middlesex",N/A,City of Williamsburg ,"Mental Health, Substance Abuse, Cancer, Heart Disease","Mental Health, Heart Disease, Cancer, Substance Abuse",https://www.sentara.com/Assets/Pdf/About-Us/Community-Health-Needs-Assessments/2019-SWRMC-Community-Health-Needs-Assessment.pdf,N/A,N/A
,,,,,,,Non-Profit,2022,Combination of counties and places,"James City, Gloucestor, York, Charles City, New Kent, King Willliam, King and Queen, Middlesex",N/A,Williamsburg,"Aging, Asthma, Cancer, Diabetes, Heart Health, Maternal Health, Mental Health, Obesity, Safety Education, Stroke, Substance Use","Behavioral Health, Chronic Disease, Social Determinants of Health",https://www.sentara.com/aboutus/community-outreach/community-health-needs-assessments,N/A,N/A
6340233,Sheltering Arms Hospital South,"13700 St. Francis Boulevard, Suite 400",Midlothian,23114-3222,VA,N/A,Non-Profit,2016,Combination of counties and places,"Amelia, Chesterfield, Dinwiddie, Goochland, Hanover, Henrico, Lunenberg, Mecklenburg, Nottoway, Petersburg, Powhatan, Prince Edward",N/A,"Colonial Heights, Hopewell, Petersburg, Richmond","Access to Healthcare, Access to Resources, Access to Education & Support, Access to Fitness & Wellness","Access to Healthcare, Access to Resources, Access to Education & Support, Access to Fitness & Wellness",https://www.shelteringarms.com/wp-content/uploads/2017/06/2016CHNA-South-webb2.pdf,https://www.shelteringarms.com/wp-content/uploads/2017/06/2016CHNA-South-webb2.pdf,N/A
6340930,Sheltering Arms Rehabilitation Hospital,8254 Atlee Road,Mechanicsville,23116-1844,VA,N/A,Unable to Find,N/A unable to find,,,,,,,,,
6340460,Smyth County Community Hospital,245 Medical Park Drive,Marion,24354,VA,Ballad Health,For-Profit,2021,List of Counties,"Smyth, Wythe",N/A,N/A,"Substance abuse, Mental Health, Adverse Childhood Experiences (ACE)","Substance abuse, Mental Health, Adverse Childhood Experiences (ACE)",https://www.balladhealth.org/sites/default/files/2021-12/Smyth_Community_Health_Needs_Assessment_2021.pdf,N/A,N/A
6340280,Southampton Memorial Hospital,100 Fairview Drive,Franklin,23851-1238,VA,"Community Health Systems, Inc.",For-Profit,2020,Combination of counties and places,"Isle of Wight, Southampton",N/A,"Franklin, Suffolk","Alcohol/Substance Use, Behavioral/Mental Health, Diabetes, Heart Conditions, Smoking/Tobacco use, Overweight/Obesity","Heart Conditions; Chronic Disease in Aging Adults (Diabetes, Obesity/Overweight)",https://www.bonsecours.com/-/media/bon-secours/community-involvement/hampton-roads/documents/southampton-chna-20-22-w-survey.ashx?la=en,https://www.bonsecours.com/-/media/bon-secours/community-involvement/hampton-roads/documents/southampton-2020-2022-implementation-strategy.ashx?la=en,N/A
6340002,Southern Virginia Mental Health Institute,382 Taylor Drive,Danville,24541-4023,VA,Virginia Department of Mental Health,Unable to Find,N/A unable to find,,,,,,,,,
6340227,Southern Virginia Regional Medical Center,727 North Main Street,Emporia,23847-1274,VA,"Community Health Systems, Inc.",Non-Profit,2020,Combination of counties and places,"Brunswick, Southampton, Sussex",N/A,"Emporia, Greensville","Mental Health & Suicide, Chronic Disease, Substance Abuse ","Chronic Disease, Behavioral Health, Social Determinants of Health, Stress/Trauma ",https://www.bonsecours.com/-/media/bon-secours/community-involvement/richmond/bon-secours-richmond-south-chna-2020.ashx?la=en,https://www.bonsecours.com/-/media/bon-secours/community-involvement/richmond/bsr-southern-va-chna-implementation-plan21-23.ashx?la=en,N/A
6340710,Southside Regional Medical Center,200 Medical Park Boulevard,Petersburg,23805-9274,VA,"Community Health Systems, Inc.",For-Profit,2020,Combination of counties and places,"Prince George, Dinwiddie, Sussex, Surry, Southern Chesterfield",N/A,"Peterburg, Hopewell, Colonial Heights, Fort Lee, Chester","Mental Health & Suicide, Chronic Diseases, Substance Abuse","Mental Health & Suicide, Chronic Diseases, Substance Abuse",https://www.bonsecours.com/-/media/bon-secours/community-involvement/richmond/bon-secours-richmond-south-chna-2020.ashx?la=en,https://www.bonsecours.com/-/media/bon-secours/community-involvement/richmond/bsr-southern-va-chna-implementation-plan21-23.ashx?la=en,N/A
6340470,Southwestern Virginia Mental Health Institute,340 Bagley Circle,Marion,24354-3390,VA,Virginia Department of Mental Health,Unable to Find,N/A unable to find,,,,,,,,,
6340220,SOVAH Health-Danville,142 South Main Street,Danville,24541-2922,VA,LifePoint Health,Unable to Find,N/A unable to find,,,,,,,,,
6340480,SOVAH Health-Martinsville,320 Hospital Drive,Martinsville,24112-1981,VA,LifePoint Health,Unable to Find,N/A unable to find,,,,,,,,,
6340023,Spotsylvania Regional Medical Center,4600 Spotsylvania Parkway,Fredericksburg,22408-7762,VA,HCA Healthcare,Public,N/A unable to find,,,,,,,,,
6340149,Stafford Hospital,101 Hospital Center Boulevard,Stafford,22554-6200,VA,Mary Washington Healthcare,Public,2019,"Combination of counties, zip codes, and places","Caroline, King George, Orange, Prince William, Spotsylvania, Stafford, Westmoreland","22488, 22469, 22572, 22960, 20109, 22427, 22534, 22580, 22514, 23117, 22733, 22172, 22535, 22546, 2294, 22701, 22567, 22542, 23024, 22401, 20110, 22191, 20111, 22443, 22538, 22520, 22026, 22448,22134, 22923, 22193, 22972, 23069, 22551, 23015, 22408, 22407,22508, 23047,22485, 22192, 22553, 22405, 22406,20119, 22556, 20181, 22554, 20136, 22025, 20155, 20112, 20137, 20169,20143",Fredericksburg,"Obesity, access to health services, substance abuse, Behavioral Health, Cancer","Access to health services and preventative care; Behavioral Health and Behavioral disorders; Exercise, Nutrition and Weight",https://www.marywashingtonhealthcare.com/documents/content/Rappahanock-2019-CHNA-FINAL.1).pdf,https://www.marywashingtonhealthcare.com/documents/content/MWHC-Implementation-Strategy2019_2022_CHNA.1).pdf,N/A
6349173,The Pavilion at Williamsburg Place,5483 Mooretown Road,Williamsburg,23188-2108,VA,,Non-Profit,N/A unable to find,,,,,,,,,
6340315,Twin County Regional Healthcare,200 Hospital Drive,Galax,24333-2227,VA,Duke LifePoint Healthcare,Non-Profit,2022,Combination of counties and places,"Carroll, Grayson, Galax",N/A,Galax,"Substance Use Disorder, Mental Health, Healthy Eating/Active Living/Food Insecurity, Socioeconomics, Education/Communication, Access to Care","Substance misuse, Lifestyle/obesity, Mental health, Family issues, Access to care, Socioeconomics, Senior issues",https://www.tcrh.org/sites/twincounty/assets/uploads/About%20Us/CHNA/Compressed_CHNA_Twin%20County%20_Community%20report_2022v1.pdf,N/A,N/A
6340335,U. S. Air Force Hospital,77 Nealy Avenue,Hampton,23665-2040,VA,Department of the Air Force,Public,N/A unable to find,,,,,,,,,
6344000,University of Virginia Medical Center,1215 Lee Street,Charlottesville,22908-0001,VA,UVA Health System,Public,N/A unable to find,,,,,,,,,
6349172,UVA Transitional Care Hospital,2965 Ivy Rd (250 West),Charlottesville,22903-9330,VA,UVA Health System,For-Profit,N/A unable to find,,,,,,,,,
6340015,UVA-HEALTHSOUTH Rehabilitation Hospital,515 Ray C Hunt Drive,Charlottesville,22903-2981,VA,Encompass Health Corporation,For-Profit,2016,Combination of counties and places,Albemarle,N/A,Charlottesville City,Increase access to needed health and rehabilitation services; Support community needs around obesity reduction and prevention; Enhance access to mental health services; Increase community resources for disabled population & caregivers,Support Community needs around Obesity Reduction and Prevention; Improve Access to Quality Community Resources for Disabled Population & Caregivers; Enhance Access to Mental Health Services; Improve Access to Needed Health and Rehabilitation Services,https://encompasshealth.com/-/media/healthsouth/project/healthsouth/locations/uvarehab-03011300/chna/bdo_uva-healthsouth_chna_final-_7-29-16_revised-pdf.pdf?la=en&hash=EF4D80BDF15DC63B82942B9402180BC73B44CA87,N/A,N/A
6341215,Valley Health Shenandoah Memorial Hospital,759 South Main Street,Woodstock,22664-1127,VA,Valley Health System,Non-Profit,2019,List of Counties,"Shenandoah, Page, Warren",N/A,N/A,"Behavioral and Health Status Factors, Access to Primary, Preventative and Specialty Care, Social and Economic Factors, Mental Health and Substance Abuse, Health Outcomes, Maternal and Child Health","Behavioral and Health Status Factors, Access to Primary, Preventative and Specialty Care, Social and Economic Factors, Mental Health and Substance Abuse, Health Outcomes, Maternal and Child Health",https://www.valleyhealthlink.com/documents/community%20health/SMH-2019-CHNA.pdf,https://www.valleyhealthlink.com/documents/community%20health/SMH-2020-2022-CHNA-Implementation-Strategy.pdf,N/A
,,,,,,,Non-Profit,2022,"Combination of counties, zip codes, and places"," Clarke, Frederick, Page, Shenandoah, Warren",22664,Winchester,"Health Behaviors and Chronic Disease, Social & Economic Factors, Access to Primary, Preventive, Clinical Care, Mental Health and Substance Abuse, Physical Environment, Health Outcomes, Maternal and Child Health","Behavioral and Health Status Factors, Access to Primary, Preventative and Specialty Care, Social and Economic Factors, Mental Health and Substance Abuse, Health Outcomes, Maternal and Child Health",https://www.valleyhealthlink.com/documents/content/SMH-CHNA-2022.pdf,https://www.valleyhealthlink.com/documents/community%20health/chna%202022/SMH-Implementation-Strategy-2023-2025-Final.pdf,N/A
6341085,VCU Health Community Memorial Hospital,125 Buena Vista Circle,South Hill,23970-1431,VA,VCU Health System,Non-Profit,2021,"Combination of counties, zip codes, and places","Brunswick, Charlotte, Lunenburg, Mecklenburg, Nottoway, Warren","23970, 23919, 23924, 23950, 23821, 23868, 23920, 23944, 23917, 23927, 23974","South Hill, Bracey, Chase City, La Crosse, Alberta, Lawrenceville, Brodnax, Kenbridge, Boydton, Clarksville, Victoria","Heart Disease, Diabetes, Respiratory Disease","Added 2x/month cardiovascular physician to offerings in CMHC, Have established tele-critical care consults with VCUMC as needed",https://www.vcuhealth.org/-/media/media/file/cmh_chna-study-report---may-2021.ashx,https://www.vcuhealth.org/-/media/media/file/cmh_chna-response-plan-2021.ashx,N/A
6340860,VCU Medical Center,1250 East Marshall Street,Richmond,23298-5051,VA,VCU Health System,Non-Profit,2022,Combination of counties and places,"Charles City, Chesterfield, Henrico, New Kent",N/A,"Colonial Heights, Hopewell, Petersburg, Richmond","depression, addiction, domestic violence, violence in homes, substance abuse, illegal drugs, adult overweight/obesity, COVID-19, maternal health, infant health","depression, addiction, domestic violence, violence in homes, substance abuse, illegal drugs, adult overweight/obesity, COVID-19, maternal health, infant health",https://www.vcuhealth.org/-/media/media/file/vcu-medical-center-and-vcu-health-asc-joint-chna-6623-accessible.ashx,N/A,N/A
6340064,Vibra Hospital of Richmond,2220 Edward Holland Drive,Richmond,23230-2519,VA,Vibra Healthcare,Non-Profit,N/A unable to find,,,,,,,,,
6340018,Virginia Beach Psychiatric Center,1100 First Colonial Road,Virginia Beach,23454-2403,VA,"Universal Health Services, Inc.",For-Profit,N/A unable to find,,,,,,,,,
6340040,Virginia Hospital Center,1701 North George Mason Drive,Arlington,22205-3698,VA,,Non-Profit,2020,"Combination of counties, zip codes, and places","Annandale, Falls Church, Mc Lean, Springfiled, Vienna, Arlington, Fort Myer, Alexandria","22003, 22041, 22042, 22043, 22044, 22046, 22101, 22102, 22150, 22151, 22182, 22201, 22202, 22203, 22204, 22205, 22206, 22207, 22209, 22211, 22213, 22301, 22302, 22304, 22305, 22311, 22312, 22314","Alexandria, Falls Church
","Mental Health, High blood pressure, adult obesity, substance abuse, aging concerns, domestic violence","Mental Health, High blood pressure, adult obesity, substance abuse, aging concerns, domestic violence",https://www.vhchealth.org/app/files/public/1753/Community-Health-Needs-Assessment--2020.pdf,https://www.vhchealth.org/app/files/public/1754/Virginia-Hospital-Center-Implementation-Strategy--2020.pdf,N/A
6340300,Warren Memorial Hospital,1000 North Shenandoah Avenue,Front Royal,22630-3598,VA,Valley Health System,Non-Profit,2022,List of Counties,"Page, Rappahannock, Shenandoah, Warren",N/A,N/A,"Health Behaviors and Chronic Disease, Social & Economic Factors, Access to Primary, Preventative, Clinical Care, Mental Health and Substance Abuse, Physical Environment, Health Outcomes, Maternal and Child Health","Health Behaviors and Chronic Disease, Social & Economic Factors, Access to Primary, Preventative, Clinical Care, Mental Health and Substance Abuse, Physical Environment, Health Outcomes, Maternal and Child Health",https://www.valleyhealthlink.com/documents/content/WMH-CHNA-2022[1].pdf,https://www.valleyhealthlink.com/documents/community%20health/chna%202022/WMH-Implementation-Strategy-2023-2025-Final.pdf,N/A
6341120,Western State Hospital,103 Valley Center Drive,Staunton,24401-9146,VA,Virginia Department of Mental Health,Public,N/A unable to find,,,,,,,,,
6341200,Winchester Medical Center,1840 Amherst Street,Winchester,22601-2808,VA,Valley Health System,For-Profit,2019,"Combination of counties, zip codes, and places","Clarke, Frederick, Hampshire, Hardy, Morgan, Page, Rappahannock, Shenandoah, Warren, Berkeley, Grant, Jefferson, Mineral","22601, 22844, 22851, 22664, 22842, 22835, 26757, 22650, 22611, 22630, 22849, 26836, 20130, 22663, 22847, 22824, 22740, 22747, 26761, 22603, 22657, 22640, 22623, 26818, 25434, 26755, 20135, 22620, 22610, 22749, 22716, 25411, 26810, 26704, 22602, 22641, 22627, 26845, 26838, 25431, 26801, 22655, 22624, 22656, 22637, 22645, 22642, 22644, 22810, 26812, 25422, 26851, 26763, 26852, 26722, 26711, 25444, 22660, 26808, 22625, 22649, 22652, 22654, 22845, 26817, 26750, 25401, 26726, 25414, 25438, 26717, 25404, 26847, 25446, 25430, 25432, 25419, 26767, 25442, 25413, 25428, 26720, 26753, 25443, 25425, 25403, 25405, 25421, 25427, 26739, 26710, 26833, 26855, 26743, 25420","Winchester, New Market, Stanley, Woodstock, Mount Jackson, Luray, Romney, Rileyville, Berryville, Front Royal, Shenandoah, Moorefield, Paris, White Post, Quicksburg, Edinburg, Sperryville, Washington, Shanks, Strasburg, Huntly, Chester Gap, Fisher, Paw, Rio, Bluemont, Boyce, Bentonville, Woodville, Castleton, Berkeley Springs, Lost City, Augusta, Winchester, Lebanon Church, Flint Hill, Old Fields, Milam, Levels, Baker, Stephens City, Clear Brook, Stephenson, Gore, Middletown, Linden, Maurertown, Basye, Mathias, Great Cacapon, Wardensville, Springfield, Purgitsville, Green Spring, Capon Bridge, Slanesville, Toms Brook, High View, Cross Junction, Middletown, Fort Valley, Star Tannery, Orkney Springs, Bloomery, Piedmont, Martinsburg, Keyser, Charles Town, Ranson, Elk Garden, Martinsburg, Petersburg, Summit Point, Kearneysville, Millville, Falling Waters, Wiley Ford, Shenandoah Junction, Bunker Hill, Inwood, Gormania, Ridgeley, Shepherdstown, Harpers Ferry, Martinsburg, Martinsburg, Glengary, Hedgesville, Mount Storm, Burlington, Fort Ashby, Maysville, Cabins, New Creek, Gerrardstown","Behavioral and Health Status Factors, Access to Primary, Preventive and Specialty Care, Social & Economic Factors, Mental Health and Substance Abuse, Health Outcomes, Maternal and Child Health ","Behavioral and Health Status Factors, Access to Primary, Preventive and Specialty Care, Mental Health and Substance Abuse",https://www.valleyhealthlink.com/documents/community%20health/WMC-2019-CHNA.pdf,https://www.valleyhealthlink.com/documents/community%20health/WMC-2020-2022-CHNA-Implementation-Strategies.pdf,N/A
6341230,Wythe County Community Hospital,600 West Ridge Road,Wytheville,24382-1099,VA,LifePoint Health,Public,N/A unable to find,,,,,,,,,
