ID,Healthcare_Name,Street_Address,City,Zipcode,State,Associated_Health_System,Funding_Type,CHNA_Year,Service_Area_Type,Service_Area_Counties,Service_Area_Zip,Service_Area_Places,Health_Needs,Health_Priorities,CHNA_URL,Implementation_URL,Contact
6350710,Thomas Memorial Hospital,4605 MacCorkle Avenue SW,South Charleston,25309-1398,WV,"Thomas Health System, Inc.",Non-Profit,2020,List of Counties,"Putnam, Kanawha",N/A,N/A,"Lack of access to health promotion and chronic disease prevention and education, Safe roads and transportation, Lack of affordable childcare options, Workforce readiness, Barriers to employment, lack of safe and adequate recreational spaces in neighborhoods","Lack of access to health promotion and chronic disease prevention and education, Safe roads and transportation, Lack of affordable childcare options, Workforce readiness, Barriers to employment, lack of safe and adequate recreational spaces in neighborhoods",https://thomashealth.org/wp-content/uploads/2020/12/TMH-CHNA-and-IS-with-Appendices-12-31-2020.pdf,https://thomashealth.org/wp-content/uploads/2020/12/TMH-CHNA-and-IS-with-Appendices-12-31-2020.pdf,N/A
6350220,United Hospital Center,327 Medical Park Drive,Bridgeport,26330-9006,WV,West Virginia University Health System,Non-Profit,2022,List of Counties,"Harrison, Doddridge",N/A,N/A,"Substance abuse and use, obesity and chronic disease, cancer","Substance abuse and use, obesity and chronic disease, cancer",https://wvumedicine.org/wp-content/uploads/2022/11/Ruby-Memorial-Hospital-CHNA-October-2022.pdf,https://wvumedicine.org/wp-content/uploads/2023/06/J.W.-Ruby-CHIP-2023.pdf,megan.govindan@hsc.wvu.edu
6350060,War Memorial Hospital,One Healthy Way,Berkeley Springs,25411-7463,WV,Valley Health System,Non-Profit,2022,List of Counties,"Berkeley, Hampshire, Morgan, grant, hardy, jefferson, mineral",N/A,N/A,"Behavioral and Health  Status Factors, Access to Primary/Preventative/Specialty Care, Social and Economic Factors, Mental Health and Substance Abuse, Health Outcomes","Behavioral and Health  Status Factors, Access to Primary/Preventative/Specialty Care, Social and Economic Factors, Mental Health and Substance Abuse, Health Outcomes",https://www.valleyhealthlink.com/documents/content/WarMH-CHNA-2022.pdf,https://www.valleyhealthlink.com/documents/community%20health/War-2020-2022-CHNA-Implementation-Strategies.pdf,N/A
6350753,Webster County Memorial Hospital,324 Miller Mountain Drive,Webster Springs,26288-1087,WV,Davis Health System,Non-Profit,2021,List of Counties,"Webster, Nicholas, Braxton",N/A,N/A,"Access to care, Behavior Health, Drug abuse, Physical Activity & Nutrition and Public Health Education","Access to care, Behavior Health, Drug & Alcohol Abuse, Physical Activity & Nutrition and Public Health education",https://www.wcmhwv.org/_files/ugd/292c43_e4cfa4570c724f44b425284a54e6cd37.pdf,N/A,mailto:SamanthaR@wcmhwv.org
6350755,Weirton Medical Center,601 Colliers Way,Weirton,26062-5091,WV,Allegheny Health Network,Non-Profit,2019,Combination of counties and zip codes,"Brooke, Hancock, Washington, Pennsylvannia, Jefferson, Ohio","26062, 26037, 26047, 43952, 26070, 15021, 26035, 43964, 43953",N/A,"Access to Care, Health Behavior, Drug & Alcohol Abuse, Physical Activity & Nutrition, Public Health Education, Tobacco Use","Chronic Disease management, Unhealthy lifestyles, Drug and Alcohol abuse",https://www.weirtonmedical.com/2019-chna-final.pdf,https://www.weirtonmedical.com/files/2022-CHNA-Action-Plan.pdf,info@getstrategy.com
6350780,Welch Community Hospital,454 McDowell Street,Welch,24801-2097,WV,West Virginia University Health System,Non-Profit,N/A unable to find,,,,,,,,,
6350007,West Virginia University Hospitals,1 Medical Center Drive,Morgantown,26506-4749,WV,West Virginia University Health System,Non-Profit,N/A unable to find,,,,,,,,,
6350580,Wetzel County Hospital,3 East Benjamin Drive,New Martinsville,26155-2758,WV,West Virginia University Health System,Non-Profit,N/A unable to find,,,,,,,,,
6350830,Wheeling Hospital,1 Medical Park,Wheeling,26003-6379,WV,West Virginia University Health System,Non-Profit,2019,List of Counties,"Ohio, Belmont, Marshall, Brooke",N/A,N/A,N/A,"Preventive Care Services, Substrance Abuse Rehabilitation Facilities, Additional community events focusing on health-related issues, general health education for the primary service area",https://wvumedicine.org/wp-content/uploads/2021/03/Wheeling-Hospital-Community-Health-Needs-Assessment-2019.pdf,https://wvumedicine.org/wp-content/uploads/2022/08/Wheeling-Hospital-CHNA-Implementation-Plan-2019.pdf,N/A
6350810,"William R. Sharpe, Jr. Hospital",936 Sharpe Hospital Road,Weston,26452-8550,WV,,Unable to Find,N/A unable to find,,,,,,,,,
6350840,Williamson Memorial Hospital,859 Alderson Street,Williamson,25661-3215,WV,,Unable to Find,N/A unable to find,,,,,,,,,
